[
  {
    "id": "ml-jadoh",
    "name": "Jadoh (Khasi rice & pork)",
    "localNames": {
      "kha": "Jadoh"
    },
    "region": "north-east",
    "state": "meghalaya",
    "category": "rice-dishes",
    "subcategory": "regional-rice",
    "dietType": "non-veg",
    "per100g": {
      "calories": 200,
      "protein": 8,
      "carbs": 24,
      "fat": 8,
      "fiber": 1
    },
    "portions": [
      {
        "unit": "plate",
        "grams": 300,
        "default": true
      },
      {
        "unit": "katori",
        "grams": 180
      },
      {
        "unit": "gram",
        "grams": 1
      }
    ],
    "oilSensitivity": "medium",
    "mealTags": [
      "lunch",
      "dinner",
      "main",
      "home-cooked"
    ],
    "healthTags": [],
    "proteinScore": 2,
    "confidence": "low",
    "source": "community-estimate",
    "lastReviewed": "2026-06-11"
  },
  {
    "id": "ml-doh-khlieh",
    "name": "Doh Khlieh (pork salad)",
    "localNames": {
      "kha": "Doh Khlieh"
    },
    "region": "north-east",
    "state": "meghalaya",
    "category": "non-veg",
    "subcategory": "pork",
    "dietType": "non-veg",
    "per100g": {
      "calories": 215,
      "protein": 17,
      "carbs": 4,
      "fat": 15,
      "fiber": 1.5
    },
    "portions": [
      {
        "unit": "katori",
        "grams": 120,
        "default": true
      },
      {
        "unit": "gram",
        "grams": 1
      }
    ],
    "oilSensitivity": "low",
    "mealTags": [
      "lunch",
      "snack",
      "home-cooked"
    ],
    "healthTags": [
      "high-protein"
    ],
    "proteinScore": 5,
    "confidence": "low",
    "source": "community-estimate",
    "lastReviewed": "2026-06-11"
  },
  {
    "id": "ml-tungrymbai",
    "name": "Tungrymbai (fermented soybean)",
    "localNames": {
      "kha": "Tungrymbai"
    },
    "region": "north-east",
    "state": "meghalaya",
    "category": "high-protein",
    "subcategory": "soya",
    "dietType": "veg",
    "per100g": {
      "calories": 180,
      "protein": 14,
      "carbs": 11,
      "fat": 9,
      "fiber": 4
    },
    "portions": [
      {
        "unit": "katori",
        "grams": 100,
        "default": true
      },
      {
        "unit": "gram",
        "grams": 1
      }
    ],
    "oilSensitivity": "medium",
    "mealTags": [
      "lunch",
      "side",
      "home-cooked"
    ],
    "healthTags": [
      "fermented",
      "high-protein",
      "vegan"
    ],
    "proteinScore": 4,
    "confidence": "low",
    "source": "community-estimate",
    "lastReviewed": "2026-06-11"
  }
]
