[
  {
    "id": "od-dalma",
    "name": "Dalma",
    "localNames": {
      "or": "Dalma"
    },
    "region": "east",
    "state": "odisha",
    "category": "dal-legumes",
    "subcategory": "dal",
    "dietType": "veg",
    "per100g": {
      "calories": 110,
      "protein": 5.5,
      "carbs": 16,
      "fat": 2.5,
      "fiber": 4
    },
    "portions": [
      {
        "unit": "katori",
        "grams": 150,
        "default": true
      },
      {
        "unit": "gram",
        "grams": 1
      }
    ],
    "oilSensitivity": "low",
    "mealTags": [
      "lunch",
      "dinner",
      "main",
      "home-cooked",
      "budget"
    ],
    "healthTags": [
      "high-fiber"
    ],
    "proteinScore": 2,
    "confidence": "medium",
    "source": "recipe-analysis",
    "lastReviewed": "2026-06-11"
  },
  {
    "id": "od-pakhala-bhata",
    "name": "Pakhala Bhata (fermented rice)",
    "localNames": {
      "or": "Pakhala"
    },
    "region": "east",
    "state": "odisha",
    "category": "rice-dishes",
    "subcategory": "regional-rice",
    "dietType": "veg",
    "per100g": {
      "calories": 90,
      "protein": 2,
      "carbs": 19,
      "fat": 0.4,
      "fiber": 0.5
    },
    "portions": [
      {
        "unit": "bowl",
        "grams": 250,
        "default": true
      },
      {
        "unit": "gram",
        "grams": 1
      }
    ],
    "oilSensitivity": "none",
    "mealTags": [
      "lunch",
      "home-cooked",
      "budget"
    ],
    "healthTags": [
      "fermented",
      "low-cal",
      "probiotic"
    ],
    "proteinScore": 1,
    "confidence": "medium",
    "source": "recipe-analysis",
    "lastReviewed": "2026-06-11"
  },
  {
    "id": "od-chhena-poda",
    "name": "Chhena Poda",
    "localNames": {
      "or": "Chhena Poda"
    },
    "region": "east",
    "state": "odisha",
    "category": "desserts",
    "subcategory": "milk-sweet",
    "dietType": "veg",
    "per100g": {
      "calories": 290,
      "protein": 11,
      "carbs": 32,
      "fat": 13,
      "fiber": 0
    },
    "portions": [
      {
        "unit": "piece",
        "grams": 60,
        "default": true
      },
      {
        "unit": "gram",
        "grams": 1
      }
    ],
    "oilSensitivity": "none",
    "mealTags": [
      "dessert",
      "festival"
    ],
    "healthTags": [],
    "proteinScore": 3,
    "confidence": "medium",
    "source": "recipe-analysis",
    "lastReviewed": "2026-06-11"
  },
  {
    "id": "od-macha-besara",
    "name": "Macha Besara (fish in mustard)",
    "localNames": {
      "or": "Macha Besara"
    },
    "region": "east",
    "state": "odisha",
    "category": "non-veg",
    "subcategory": "fish",
    "dietType": "non-veg",
    "per100g": {
      "calories": 160,
      "protein": 14,
      "carbs": 4,
      "fat": 10,
      "fiber": 1
    },
    "portions": [
      {
        "unit": "katori",
        "grams": 150,
        "default": true
      },
      {
        "unit": "gram",
        "grams": 1
      }
    ],
    "oilSensitivity": "high",
    "mealTags": [
      "lunch",
      "dinner",
      "main",
      "home-cooked"
    ],
    "healthTags": [
      "high-protein"
    ],
    "proteinScore": 4,
    "confidence": "medium",
    "source": "recipe-analysis",
    "lastReviewed": "2026-06-11"
  }
]
