[
  {
    "id": "tn-sambar",
    "name": "Sambar",
    "localNames": {
      "ta": "Sambar"
    },
    "region": "south",
    "state": "tamil-nadu",
    "category": "dal-legumes",
    "subcategory": "dal",
    "dietType": "veg",
    "per100g": {
      "calories": 85,
      "protein": 3.5,
      "carbs": 11,
      "fat": 3,
      "fiber": 3
    },
    "portions": [
      {
        "unit": "katori",
        "grams": 150,
        "default": true
      },
      {
        "unit": "ladle",
        "grams": 100
      },
      {
        "unit": "gram",
        "grams": 1
      }
    ],
    "oilSensitivity": "low",
    "mealTags": [
      "breakfast",
      "lunch",
      "dinner",
      "main",
      "home-cooked",
      "budget"
    ],
    "healthTags": [
      "low-cal"
    ],
    "proteinScore": 1,
    "confidence": "medium",
    "source": "recipe-analysis",
    "lastReviewed": "2026-06-11"
  },
  {
    "id": "tn-rasam",
    "name": "Rasam",
    "localNames": {
      "ta": "Rasam"
    },
    "region": "south",
    "state": "tamil-nadu",
    "category": "dal-legumes",
    "subcategory": "dal",
    "dietType": "veg",
    "per100g": {
      "calories": 40,
      "protein": 1.5,
      "carbs": 6,
      "fat": 1.2,
      "fiber": 1
    },
    "portions": [
      {
        "unit": "katori",
        "grams": 150,
        "default": true
      },
      {
        "unit": "gram",
        "grams": 1
      }
    ],
    "oilSensitivity": "low",
    "mealTags": [
      "lunch",
      "dinner",
      "side",
      "home-cooked",
      "budget"
    ],
    "healthTags": [
      "low-cal"
    ],
    "proteinScore": 1,
    "confidence": "medium",
    "source": "recipe-analysis",
    "lastReviewed": "2026-06-11"
  },
  {
    "id": "tn-masala-dosa",
    "name": "Masala Dosa",
    "localNames": {
      "ta": "Masala Dosai"
    },
    "region": "south",
    "state": "tamil-nadu",
    "category": "breakfast",
    "subcategory": "south-tiffin",
    "dietType": "veg",
    "per100g": {
      "calories": 185,
      "protein": 4,
      "carbs": 30,
      "fat": 5.5,
      "fiber": 1.8
    },
    "portions": [
      {
        "unit": "dosa",
        "grams": 150,
        "default": true,
        "label": "1 masala dosa"
      },
      {
        "unit": "gram",
        "grams": 1
      }
    ],
    "oilSensitivity": "medium",
    "mealTags": [
      "breakfast",
      "dinner",
      "restaurant",
      "home-cooked"
    ],
    "healthTags": [],
    "proteinScore": 1,
    "confidence": "medium",
    "source": "recipe-analysis",
    "lastReviewed": "2026-06-11"
  },
  {
    "id": "tn-medu-vada",
    "name": "Medu Vada",
    "localNames": {
      "ta": "Medu Vadai"
    },
    "region": "south",
    "state": "tamil-nadu",
    "category": "breakfast",
    "subcategory": "south-tiffin",
    "dietType": "veg",
    "per100g": {
      "calories": 250,
      "protein": 7,
      "carbs": 30,
      "fat": 11,
      "fiber": 3
    },
    "portions": [
      {
        "unit": "vada",
        "grams": 45,
        "default": true,
        "label": "1 vada"
      },
      {
        "unit": "gram",
        "grams": 1
      }
    ],
    "oilSensitivity": "fried",
    "mealTags": [
      "breakfast",
      "snack",
      "home-cooked"
    ],
    "healthTags": [
      "fried"
    ],
    "proteinScore": 2,
    "confidence": "medium",
    "source": "recipe-analysis",
    "lastReviewed": "2026-06-11"
  },
  {
    "id": "tn-pongal",
    "name": "Ven Pongal",
    "localNames": {
      "ta": "Pongal"
    },
    "region": "south",
    "state": "tamil-nadu",
    "category": "breakfast",
    "subcategory": "south-tiffin",
    "dietType": "veg",
    "per100g": {
      "calories": 170,
      "protein": 5,
      "carbs": 26,
      "fat": 5,
      "fiber": 1.5
    },
    "portions": [
      {
        "unit": "katori",
        "grams": 150,
        "default": true
      },
      {
        "unit": "gram",
        "grams": 1
      }
    ],
    "oilSensitivity": "medium",
    "mealTags": [
      "breakfast",
      "home-cooked",
      "festival"
    ],
    "healthTags": [],
    "proteinScore": 1,
    "confidence": "medium",
    "source": "recipe-analysis",
    "lastReviewed": "2026-06-11"
  },
  {
    "id": "tn-curd-rice",
    "name": "Curd Rice (Thayir Sadham)",
    "localNames": {
      "ta": "Thayir Sadham"
    },
    "region": "south",
    "state": "tamil-nadu",
    "category": "rice-dishes",
    "subcategory": "curd-rice",
    "dietType": "veg",
    "per100g": {
      "calories": 110,
      "protein": 3,
      "carbs": 18,
      "fat": 2.8,
      "fiber": 0.6
    },
    "portions": [
      {
        "unit": "katori",
        "grams": 150,
        "default": true
      },
      {
        "unit": "gram",
        "grams": 1
      }
    ],
    "oilSensitivity": "low",
    "mealTags": [
      "lunch",
      "dinner",
      "home-cooked",
      "budget"
    ],
    "healthTags": [
      "probiotic"
    ],
    "proteinScore": 1,
    "confidence": "medium",
    "source": "recipe-analysis",
    "lastReviewed": "2026-06-11"
  },
  {
    "id": "tn-chettinad-chicken",
    "name": "Chettinad Chicken",
    "localNames": {
      "ta": "Chettinad Kozhi"
    },
    "region": "south",
    "state": "tamil-nadu",
    "category": "non-veg",
    "subcategory": "chicken",
    "dietType": "non-veg",
    "per100g": {
      "calories": 200,
      "protein": 17,
      "carbs": 5,
      "fat": 12,
      "fiber": 1.5
    },
    "portions": [
      {
        "unit": "katori",
        "grams": 150,
        "default": true
      },
      {
        "unit": "gram",
        "grams": 1
      }
    ],
    "oilSensitivity": "high",
    "mealTags": [
      "lunch",
      "dinner",
      "main",
      "restaurant"
    ],
    "healthTags": [
      "high-protein"
    ],
    "proteinScore": 5,
    "confidence": "medium",
    "source": "recipe-analysis",
    "lastReviewed": "2026-06-11"
  },
  {
    "id": "tn-filter-coffee",
    "name": "Filter Coffee",
    "localNames": {
      "ta": "Kaapi"
    },
    "region": "south",
    "state": "tamil-nadu",
    "category": "drinks",
    "subcategory": "hot-beverage",
    "dietType": "veg",
    "per100g": {
      "calories": 60,
      "protein": 1.8,
      "carbs": 8,
      "fat": 2.2,
      "fiber": 0
    },
    "portions": [
      {
        "unit": "cup",
        "grams": 120,
        "default": true
      },
      {
        "unit": "gram",
        "grams": 1
      }
    ],
    "oilSensitivity": "none",
    "mealTags": [
      "breakfast",
      "drink",
      "snack"
    ],
    "healthTags": [
      "low-cal"
    ],
    "proteinScore": 1,
    "confidence": "medium",
    "source": "recipe-analysis",
    "lastReviewed": "2026-06-11"
  }
]
