[
  {
    "id": "mh-poha-kanda",
    "name": "Kanda Poha",
    "localNames": {
      "mr": "Kanda Pohe"
    },
    "region": "west",
    "state": "maharashtra",
    "category": "breakfast",
    "subcategory": "regional-breakfast",
    "dietType": "veg",
    "per100g": {
      "calories": 180,
      "protein": 3,
      "carbs": 33,
      "fat": 4.5,
      "fiber": 1.5
    },
    "portions": [
      {
        "unit": "plate",
        "grams": 200,
        "default": true
      },
      {
        "unit": "katori",
        "grams": 130
      },
      {
        "unit": "gram",
        "grams": 1
      }
    ],
    "oilSensitivity": "medium",
    "mealTags": [
      "breakfast",
      "snack",
      "home-cooked",
      "budget",
      "student"
    ],
    "healthTags": [],
    "proteinScore": 1,
    "confidence": "medium",
    "source": "recipe-analysis",
    "lastReviewed": "2026-06-11"
  },
  {
    "id": "mh-vada-pav",
    "name": "Vada Pav",
    "localNames": {
      "mr": "Vada Pav"
    },
    "region": "west",
    "state": "maharashtra",
    "category": "street-food",
    "subcategory": "pav-based",
    "dietType": "veg",
    "per100g": {
      "calories": 290,
      "protein": 6,
      "carbs": 38,
      "fat": 12,
      "fiber": 2.5
    },
    "portions": [
      {
        "unit": "piece",
        "grams": 130,
        "default": true,
        "label": "1 vada pav"
      },
      {
        "unit": "gram",
        "grams": 1
      }
    ],
    "oilSensitivity": "fried",
    "mealTags": [
      "snack",
      "street",
      "budget",
      "student"
    ],
    "healthTags": [
      "fried"
    ],
    "proteinScore": 2,
    "confidence": "medium",
    "source": "recipe-analysis",
    "lastReviewed": "2026-06-11"
  },
  {
    "id": "mh-misal-pav",
    "name": "Misal Pav",
    "localNames": {
      "mr": "Misal Pav"
    },
    "region": "west",
    "state": "maharashtra",
    "category": "street-food",
    "subcategory": "pav-based",
    "dietType": "veg",
    "per100g": {
      "calories": 180,
      "protein": 7,
      "carbs": 22,
      "fat": 7,
      "fiber": 5
    },
    "portions": [
      {
        "unit": "plate",
        "grams": 300,
        "default": true
      },
      {
        "unit": "gram",
        "grams": 1
      }
    ],
    "oilSensitivity": "medium",
    "mealTags": [
      "breakfast",
      "lunch",
      "street",
      "budget"
    ],
    "healthTags": [
      "high-fiber"
    ],
    "proteinScore": 2,
    "confidence": "medium",
    "source": "recipe-analysis",
    "lastReviewed": "2026-06-11"
  },
  {
    "id": "mh-pav-bhaji",
    "name": "Pav Bhaji",
    "localNames": {
      "mr": "Pav Bhaji"
    },
    "region": "west",
    "state": "maharashtra",
    "category": "street-food",
    "subcategory": "pav-based",
    "dietType": "veg",
    "per100g": {
      "calories": 200,
      "protein": 4.5,
      "carbs": 24,
      "fat": 10,
      "fiber": 3
    },
    "portions": [
      {
        "unit": "plate",
        "grams": 350,
        "default": true,
        "label": "2 pav + bhaji"
      },
      {
        "unit": "gram",
        "grams": 1
      }
    ],
    "oilSensitivity": "high",
    "mealTags": [
      "snack",
      "dinner",
      "street",
      "restaurant"
    ],
    "healthTags": [],
    "proteinScore": 1,
    "confidence": "medium",
    "source": "recipe-analysis",
    "lastReviewed": "2026-06-11"
  },
  {
    "id": "mh-puran-poli",
    "name": "Puran Poli",
    "localNames": {
      "mr": "Puran Poli"
    },
    "region": "west",
    "state": "maharashtra",
    "category": "desserts",
    "subcategory": "festival-sweet",
    "dietType": "veg",
    "per100g": {
      "calories": 320,
      "protein": 7,
      "carbs": 54,
      "fat": 8.5,
      "fiber": 3.5
    },
    "portions": [
      {
        "unit": "piece",
        "grams": 80,
        "default": true,
        "label": "1 puran poli"
      },
      {
        "unit": "gram",
        "grams": 1
      }
    ],
    "oilSensitivity": "medium",
    "mealTags": [
      "dessert",
      "festival",
      "home-cooked"
    ],
    "healthTags": [
      "high-cal",
      "high-carb"
    ],
    "proteinScore": 2,
    "confidence": "medium",
    "source": "recipe-analysis",
    "lastReviewed": "2026-06-11"
  },
  {
    "id": "mh-zunka",
    "name": "Zunka (dry)",
    "localNames": {
      "mr": "Zunka"
    },
    "region": "west",
    "state": "maharashtra",
    "category": "dal-legumes",
    "subcategory": "besan-based",
    "dietType": "veg",
    "per100g": {
      "calories": 175,
      "protein": 7,
      "carbs": 18,
      "fat": 8.5,
      "fiber": 4
    },
    "portions": [
      {
        "unit": "katori",
        "grams": 120,
        "default": true
      },
      {
        "unit": "gram",
        "grams": 1
      }
    ],
    "oilSensitivity": "medium",
    "mealTags": [
      "lunch",
      "dinner",
      "home-cooked",
      "budget"
    ],
    "healthTags": [],
    "proteinScore": 2,
    "confidence": "medium",
    "source": "recipe-analysis",
    "lastReviewed": "2026-06-11"
  },
  {
    "id": "mh-modak",
    "name": "Ukadiche Modak",
    "localNames": {
      "mr": "Modak"
    },
    "region": "west",
    "state": "maharashtra",
    "category": "desserts",
    "subcategory": "festival-sweet",
    "dietType": "veg",
    "per100g": {
      "calories": 230,
      "protein": 3.5,
      "carbs": 40,
      "fat": 6.5,
      "fiber": 2.5
    },
    "portions": [
      {
        "unit": "piece",
        "grams": 40,
        "default": true
      },
      {
        "unit": "gram",
        "grams": 1
      }
    ],
    "oilSensitivity": "none",
    "mealTags": [
      "dessert",
      "festival"
    ],
    "healthTags": [],
    "proteinScore": 1,
    "confidence": "medium",
    "source": "recipe-analysis",
    "lastReviewed": "2026-06-11"
  }
]
